{
  "canon": "ROAX-CANON/1",
  "hashAlg": "SHA-256",
  "recordType": "sg.gov.moh.recovery-healthcert",
  "schemaVersion": "2.0",
  "recordId": "urn:uuid:11111111-1111-4111-8111-111111111111",
  "root": "b1c56cd4fc6bf4c33fc68b0b39a4a87c5c42f953d140e1b71d7675d7d4333bf3",
  "leafCount": 13,
  "issuer": {
    "id": "did:web:corpus.roax.invalid",
    "keyId": "did:web:corpus.roax.invalid#key-1"
  },
  "disclosure": {
    "mode": "selective",
    "leaves": [
      {
        "segments": [
          {
            "key": "roax.recordType"
          }
        ],
        "displayPath": "roax.recordType",
        "index": 8,
        "tag": 2,
        "value": "sg.gov.moh.recovery-healthcert",
        "salt": "6121d30129d6d5a35f529a9a82be6287",
        "auditPath": [
          "0565b3bdbefabc305b7b1fc68090ae9a24bad3f013b4933004e12103cf3ccd51",
          "35fdd24a115de881cd0a2ed238e510d8a920c602ad05dc75df45070827e3b77d",
          "cd3e709b24f045529781baf3f20e6c41d1a648e35bc0f363ccb660a5cc196d08",
          "b85fd4ae19a426daa8559c76e9146ee974f937a3c35188c76df5382d5f64aad4"
        ]
      },
      {
        "segments": [
          {
            "key": "roax.schemaVersion"
          }
        ],
        "displayPath": "roax.schemaVersion",
        "index": 10,
        "tag": 2,
        "value": "2.0",
        "salt": "cf65fa9bf6d22168b635a99f58e21293",
        "auditPath": [
          "0554504cbaee8d16d142fb22d616d7ba26e5545d96a7526c14cfc16162e65baf",
          "4d9b5c21041b1a233b618ade2f9a217a2b1232b0b9babbabf24f33426a2f7213",
          "cd3e709b24f045529781baf3f20e6c41d1a648e35bc0f363ccb660a5cc196d08",
          "b85fd4ae19a426daa8559c76e9146ee974f937a3c35188c76df5382d5f64aad4"
        ]
      },
      {
        "segments": [
          {
            "key": "roax.issuer.id"
          }
        ],
        "displayPath": "roax.issuer.id",
        "index": 7,
        "tag": 2,
        "value": "did:web:corpus.roax.invalid",
        "salt": "8074f5965127f82a6dc6a4b642323424",
        "auditPath": [
          "c5fa602648fda6aeb80bf94f14a9aa757d832adebb1d7003e8f17e51915cc80d",
          "e3d89fc434c428990342f0b42144a7f6028abadce86d25f3f3f4c07a6f387418",
          "12533452ce9aa09e143d1ac5a379d418d999d657d428f46f73dfa55516d09f6e",
          "cfc58701e3e345b715b8c082247cfab358a4c943179709afe86d3c8d9df4e8fa"
        ]
      },
      {
        "segments": [
          {
            "key": "version"
          }
        ],
        "displayPath": "version",
        "index": 2,
        "tag": 2,
        "value": "rec-healthcert-v2.0",
        "salt": "32be5495760aa2d3aa6dd46a240dfe43",
        "auditPath": [
          "337425f05cb2e8c4abbb7f1d5b776d2f74bd61c2f44d910b87be7fb08410133b",
          "eb348204f47bcfca419845f411095b823c68cd0a352f153f7e1e205eb94f2296",
          "596089593e09f26ab68ad5e583db50871313e62bc8d02918ac22887d9d760f3f",
          "cfc58701e3e345b715b8c082247cfab358a4c943179709afe86d3c8d9df4e8fa"
        ]
      },
      {
        "segments": [
          {
            "key": "type"
          }
        ],
        "displayPath": "type",
        "index": 1,
        "tag": 2,
        "value": "PCR",
        "salt": "15f66df13dbbf654eefbde70dbf21e6e",
        "auditPath": [
          "96fe5f491c9f14e6bea2538f987c4d49b98db44cff45a2d7c7885fa17438ddb9",
          "f35db6bb2ebf8a4dd61e1afe76e5a59df98a214299e98630033fe1ddae6ebb88",
          "596089593e09f26ab68ad5e583db50871313e62bc8d02918ac22887d9d760f3f",
          "cfc58701e3e345b715b8c082247cfab358a4c943179709afe86d3c8d9df4e8fa"
        ]
      },
      {
        "segments": [
          {
            "key": "validFrom"
          }
        ],
        "displayPath": "validFrom",
        "index": 3,
        "tag": 2,
        "value": "2026-07-28T00:00:00Z",
        "salt": "3c1050ed3c3be6405dbc7c899d3db9d5",
        "auditPath": [
          "c530cf973bdb3ae2e3d6b56e5d951285819917ecd90b7320efd396b2475674be",
          "eb348204f47bcfca419845f411095b823c68cd0a352f153f7e1e205eb94f2296",
          "596089593e09f26ab68ad5e583db50871313e62bc8d02918ac22887d9d760f3f",
          "cfc58701e3e345b715b8c082247cfab358a4c943179709afe86d3c8d9df4e8fa"
        ]
      },
      {
        "segments": [
          {
            "key": "validUntil"
          }
        ],
        "displayPath": "validUntil",
        "index": 4,
        "tag": 2,
        "value": "2026-10-28T00:00:00Z",
        "salt": "97a12dbc59b34e0a7dc13d79f840c5b2",
        "auditPath": [
          "bac6de769d41ca691f8c63254da285c228aebabf736e09c19db49f74fe2b6b0f",
          "33e08bc485a465e4f42ded12f7220b4638210d96952e0e16d52f99604314dac2",
          "12533452ce9aa09e143d1ac5a379d418d999d657d428f46f73dfa55516d09f6e",
          "cfc58701e3e345b715b8c082247cfab358a4c943179709afe86d3c8d9df4e8fa"
        ]
      },
      {
        "segments": [
          {
            "key": "roax.issuer.keyId"
          }
        ],
        "displayPath": "roax.issuer.keyId",
        "index": 9,
        "tag": 2,
        "value": "did:web:corpus.roax.invalid#key-1",
        "salt": "3bcc70d439697c608a0eafedf6ad1887",
        "auditPath": [
          "774b0170365ee3a0ca53ea1482ed018f6db755a6d546fe05aeea375f23525c26",
          "35fdd24a115de881cd0a2ed238e510d8a920c602ad05dc75df45070827e3b77d",
          "cd3e709b24f045529781baf3f20e6c41d1a648e35bc0f363ccb660a5cc196d08",
          "b85fd4ae19a426daa8559c76e9146ee974f937a3c35188c76df5382d5f64aad4"
        ]
      }
    ]
  }
}
