{
  "canon": "ROAX-CANON/1",
  "hashAlg": "SHA-256",
  "recordType": "org.roax.corpus.synthetic",
  "schemaVersion": "1.0",
  "recordId": "urn:uuid:11111111-1111-4111-8111-111111111111",
  "root": "906206bfe0f1e5e57c9345ba605b675a2cab7de26a247a587d3c6305ef1cb255",
  "leafCount": 9,
  "issuer": {
    "id": "did:web:corpus.roax.invalid"
  },
  "record": {
    "counts": { "integer": 5, "decimal": 0.010, "text": "5" },
    "flag": true,
    "marker": "typed"
  },
  "salts": [
    {
      "segments": [
        {
          "key": "flag"
        }
      ],
      "salt": "2f65021180914c9f1e146b89dafc9f23"
    },
    {
      "segments": [
        {
          "key": "marker"
        }
      ],
      "salt": "a51963873dc8f4325dbcf607f4ce1f1a"
    },
    {
      "segments": [
        {
          "key": "roax.recordId"
        }
      ],
      "salt": "98b8055870e713e8be7cbd40f03055ab"
    },
    {
      "segments": [
        {
          "key": "roax.issuer.id"
        }
      ],
      "salt": "3baf1dd047a2ded6909f06c5d4865e22"
    },
    {
      "segments": [
        {
          "key": "roax.recordType"
        }
      ],
      "salt": "c26189cf7647dfa19e287ad9cf24f359"
    },
    {
      "segments": [
        {
          "key": "roax.schemaVersion"
        }
      ],
      "salt": "d86d8c746bfb225f6a4e8f84d1915902"
    },
    {
      "segments": [
        {
          "key": "counts"
        },
        {
          "key": "text"
        }
      ],
      "salt": "970cb28f0c5ed29220ab9c7d7581bb1e"
    },
    {
      "segments": [
        {
          "key": "counts"
        },
        {
          "key": "decimal"
        }
      ],
      "salt": "d5973c94ebe921519029fee2bdaec835"
    },
    {
      "segments": [
        {
          "key": "notALeafInThisTree"
        }
      ],
      "salt": "9965cbb9e3bf5f827a28d0b58d5cff2a"
    }
  ]
}
