{
  "canon": "ROAX-CANON/1",
  "hashAlg": "SHA-256",
  "recordType": "sg.gov.moh.recovery-healthcert",
  "schemaVersion": "2.0",
  "recordId": "urn:uuid:11111111-1111-4111-8111-111111111111",
  "root": "bf82777fd06d66f15eea3ba472e5da6799ea8721905b4b1d51e075a9ba90f396",
  "leafCount": 13,
  "issuer": {
    "id": "did:web:corpus.roax.invalid",
    "keyId": "did:web:corpus.roax.invalid#key-1"
  },
  "disclosure": {
    "mode": "selective",
    "leaves": [
      {
        "segments": [
          {
            "key": "roax.recordType"
          }
        ],
        "displayPath": "roax.recordType",
        "index": 8,
        "tag": 2,
        "value": "sg.gov.moh.recovery-healthcert",
        "salt": "c24889ba40e46be7643a6c1d2030e125",
        "auditPath": [
          "7339ae575cff53b25a97a6ce33c052fc4bc49ce9d082e94e9535f4283a7f4f19",
          "13316541a65143f9cf03c4e2fdf72aa550aad60401e13fc83207df2d8cc91942",
          "bf474473c5f9e62b692f71b426da4766c3e7d56f4f2891623f4bdfac32de3d2d",
          "fc1644671a577997a404f6786017e126c8e1003c4dce5c18cd5951777dc19312"
        ]
      },
      {
        "segments": [
          {
            "key": "roax.schemaVersion"
          }
        ],
        "displayPath": "roax.schemaVersion",
        "index": 10,
        "tag": 2,
        "value": "2.0",
        "salt": "dde8c29a376074d7043fc68d7c15061e",
        "auditPath": [
          "ce2173bc1c66b21496a373e56823dc9b6c47a19b5f1241be34292088db2b5037",
          "af494aa628f1f04c3f21e1e21ad075dd35dab8bcb99cdb53dd7e4e98fa4c3b13",
          "bf474473c5f9e62b692f71b426da4766c3e7d56f4f2891623f4bdfac32de3d2d",
          "fc1644671a577997a404f6786017e126c8e1003c4dce5c18cd5951777dc19312"
        ]
      },
      {
        "segments": [
          {
            "key": "roax.recordId"
          }
        ],
        "displayPath": "roax.recordId",
        "index": 6,
        "tag": 2,
        "value": "urn:uuid:11111111-1111-4111-8111-111111111111",
        "salt": "312b7634d0bbc798038f1516776c403b",
        "auditPath": [
          "cb113d9fe589d57a00b055a99ea15d9bb9e8468e76ac995aba740c415368add4",
          "353c56cb28d87697999916ab3ce1d170860d78f8e87995d09c5c26e81734a419",
          "bbcc34bfd3a2f39805a01ff149261b91a85b2f1dfa9514f0191e2a9250cc703c",
          "e7a28f6b914bb2836ab4e0d7aec78e241981912ac800d85699ff8250518878b2"
        ]
      },
      {
        "segments": [
          {
            "key": "version"
          }
        ],
        "displayPath": "version",
        "index": 2,
        "tag": 2,
        "value": "rec-healthcert-v2.0",
        "salt": "cdfe9bac8b28a9ca203d4855d8d9e842",
        "auditPath": [
          "39c31a8c4444d880bc1d2469f26bbf547947b31a1d1740373b59485cb51f7a66",
          "9600d3f862e55b5aacc2ce0ba11386c2967a5b8863f80f2fe553e4374868e741",
          "621f51db781eba72f74fdbeafdb3210de9b1cf81b7f2ba46ecc58ca5ddb1fad9",
          "e7a28f6b914bb2836ab4e0d7aec78e241981912ac800d85699ff8250518878b2"
        ]
      },
      {
        "segments": [
          {
            "key": "type"
          }
        ],
        "displayPath": "type",
        "index": 1,
        "tag": 2,
        "value": "PCR",
        "salt": "b69f27db157c304d50e4c8e4c6c256a5",
        "auditPath": [
          "f8a19c6b109244ee4fc29d3a9cd3ba0722d07ff0f090dbcaa64fdb7a58623b70",
          "ae7950dcfa88aae20bd6bae7e1ddbf3989026650e01f9c6defd90611c05b5fe9",
          "621f51db781eba72f74fdbeafdb3210de9b1cf81b7f2ba46ecc58ca5ddb1fad9",
          "e7a28f6b914bb2836ab4e0d7aec78e241981912ac800d85699ff8250518878b2"
        ]
      },
      {
        "segments": [
          {
            "key": "validFrom"
          }
        ],
        "displayPath": "validFrom",
        "index": 3,
        "tag": 2,
        "value": "2026-07-28T00:00:00Z",
        "salt": "47824e6a50f1ed8c25d014cc035d6c69",
        "auditPath": [
          "1db3c96813642e487e2ba4cf393649912e0d7d2f6b6e4a4eb08d2c9d1eca3b31",
          "9600d3f862e55b5aacc2ce0ba11386c2967a5b8863f80f2fe553e4374868e741",
          "621f51db781eba72f74fdbeafdb3210de9b1cf81b7f2ba46ecc58ca5ddb1fad9",
          "e7a28f6b914bb2836ab4e0d7aec78e241981912ac800d85699ff8250518878b2"
        ]
      },
      {
        "segments": [
          {
            "key": "validUntil"
          }
        ],
        "displayPath": "validUntil",
        "index": 4,
        "tag": 2,
        "value": "2026-10-28T00:00:00Z",
        "salt": "03d7b6ccdd801db8ac2c2150b0ff0cce",
        "auditPath": [
          "37771df7f467c21a9ff9a810a971598cdab55c083b6a81b537619349051ceda4",
          "7a7437dfd0e20e4cf11384425bdf00d27236871bf233c76251a51fd22176cda5",
          "bbcc34bfd3a2f39805a01ff149261b91a85b2f1dfa9514f0191e2a9250cc703c",
          "e7a28f6b914bb2836ab4e0d7aec78e241981912ac800d85699ff8250518878b2"
        ]
      },
      {
        "segments": [
          {
            "key": "roax.issuer.keyId"
          }
        ],
        "displayPath": "roax.issuer.keyId",
        "index": 9,
        "tag": 2,
        "value": "did:web:corpus.roax.invalid#key-1",
        "salt": "2a485e75eaf030468968581cc7ee3b3e",
        "auditPath": [
          "a4fe19ef46cf1dfbc88b2559c968378aaeead2565022b4a1e4cace947696d0e3",
          "13316541a65143f9cf03c4e2fdf72aa550aad60401e13fc83207df2d8cc91942",
          "bf474473c5f9e62b692f71b426da4766c3e7d56f4f2891623f4bdfac32de3d2d",
          "fc1644671a577997a404f6786017e126c8e1003c4dce5c18cd5951777dc19312"
        ]
      }
    ]
  }
}
