{
  "canon": "ROAX-CANON/1",
  "hashAlg": "SHA-256",
  "recordType": "sg.gov.moh.vaccination-healthcert",
  "schemaVersion": "1.0",
  "recordId": "urn:uuid:11111111-1111-4111-8111-111111111111",
  "root": "8da0bbbfa7fd3e7ed18989b35db4e003f367f7c8b9c4953b635ef4c4fe863fa5",
  "leafCount": 11,
  "issuer": {
    "id": "did:web:corpus.roax.invalid",
    "keyId": "did:web:corpus.roax.invalid#key-1"
  },
  "disclosure": {
    "mode": "selective",
    "leaves": [
      {
        "segments": [
          {
            "key": "roax.recordType"
          }
        ],
        "displayPath": "roax.recordType",
        "index": 5,
        "tag": 2,
        "value": "sg.gov.moh.vaccination-healthcert",
        "salt": "c24889ba40e46be7643a6c1d2030e125",
        "auditPath": [
          "cb113d9fe589d57a00b055a99ea15d9bb9e8468e76ac995aba740c415368add4",
          "fc1449b34b7bc1cb6c67f14a57d19713744b1973d2512bc2cfdfe9f0439a600b",
          "d4fbcc61dbd096cb711254f7811881638a2f8076014a75114955fcb388555843",
          "1bd5ed39262cabe533aeaedeebdadf3779b86dd572bfaf990a660acde2303fd1"
        ]
      },
      {
        "segments": [
          {
            "key": "roax.schemaVersion"
          }
        ],
        "displayPath": "roax.schemaVersion",
        "index": 7,
        "tag": 2,
        "value": "1.0",
        "salt": "dde8c29a376074d7043fc68d7c15061e",
        "auditPath": [
          "7339ae575cff53b25a97a6ce33c052fc4bc49ce9d082e94e9535f4283a7f4f19",
          "94c8768faf82718fa5ec7993ea42e76adfea2b1f2fa59955320aa0afef7c7b1f",
          "d4fbcc61dbd096cb711254f7811881638a2f8076014a75114955fcb388555843",
          "1bd5ed39262cabe533aeaedeebdadf3779b86dd572bfaf990a660acde2303fd1"
        ]
      },
      {
        "segments": [
          {
            "key": "roax.recordId"
          }
        ],
        "displayPath": "roax.recordId",
        "index": 3,
        "tag": 2,
        "value": "urn:uuid:11111111-1111-4111-8111-111111111111",
        "salt": "312b7634d0bbc798038f1516776c403b",
        "auditPath": [
          "37771df7f467c21a9ff9a810a971598cdab55c083b6a81b537619349051ceda4",
          "1a183d5646f8c5ac6012edfe4d0b43e470b20e23461848f0044e4da33495f1d0",
          "0c16e5b35e6b518be7105fe9b7a4c19a975c084aef7494d8fdb00c08f6f7fd26",
          "1bd5ed39262cabe533aeaedeebdadf3779b86dd572bfaf990a660acde2303fd1"
        ]
      },
      {
        "segments": [
          {
            "key": "roax.issuer.id"
          }
        ],
        "displayPath": "roax.issuer.id",
        "index": 4,
        "tag": 2,
        "value": "did:web:corpus.roax.invalid",
        "salt": "81b4daf535d4f8dbc2a121bc2f4e92a7",
        "auditPath": [
          "4c96c4a98cb5412c99289e23faefb81beb3281e3bd93ed5b075f76a640918c90",
          "fc1449b34b7bc1cb6c67f14a57d19713744b1973d2512bc2cfdfe9f0439a600b",
          "d4fbcc61dbd096cb711254f7811881638a2f8076014a75114955fcb388555843",
          "1bd5ed39262cabe533aeaedeebdadf3779b86dd572bfaf990a660acde2303fd1"
        ]
      },
      {
        "segments": [
          {
            "key": "validFrom"
          }
        ],
        "displayPath": "validFrom",
        "index": 1,
        "tag": 2,
        "value": "2026-07-28T00:00:00Z",
        "salt": "47824e6a50f1ed8c25d014cc035d6c69",
        "auditPath": [
          "f8a19c6b109244ee4fc29d3a9cd3ba0722d07ff0f090dbcaa64fdb7a58623b70",
          "32c005dfe18fe1f9c370d5a1c3a5912fb31a6a95860aa10442531a1a502ac55e",
          "0c16e5b35e6b518be7105fe9b7a4c19a975c084aef7494d8fdb00c08f6f7fd26",
          "1bd5ed39262cabe533aeaedeebdadf3779b86dd572bfaf990a660acde2303fd1"
        ]
      },
      {
        "segments": [
          {
            "key": "notarisationMetadata.reference"
          }
        ],
        "displayPath": "notarisationMetadata.reference",
        "index": 8,
        "tag": 2,
        "value": "urn:uuid:notary-1",
        "salt": "3d9b7f528c30c568984d7ba94e8b31f7",
        "auditPath": [
          "ce2173bc1c66b21496a373e56823dc9b6c47a19b5f1241be34292088db2b5037",
          "bf474473c5f9e62b692f71b426da4766c3e7d56f4f2891623f4bdfac32de3d2d",
          "d94edf52a4379945be66c9d1542d71dfaeb87926826b1694367a87efe9d2642e"
        ]
      },
      {
        "segments": [
          {
            "key": "roax.issuer.keyId"
          }
        ],
        "displayPath": "roax.issuer.keyId",
        "index": 6,
        "tag": 2,
        "value": "did:web:corpus.roax.invalid#key-1",
        "salt": "2a485e75eaf030468968581cc7ee3b3e",
        "auditPath": [
          "945a40f2d13eb1003f8b753cfb50067f73928db03b782b71f36caa39bee642a7",
          "94c8768faf82718fa5ec7993ea42e76adfea2b1f2fa59955320aa0afef7c7b1f",
          "d4fbcc61dbd096cb711254f7811881638a2f8076014a75114955fcb388555843",
          "1bd5ed39262cabe533aeaedeebdadf3779b86dd572bfaf990a660acde2303fd1"
        ]
      }
    ]
  }
}
