{
  "canon": "ROAX-CANON/1",
  "hashAlg": "SHA-256",
  "recordType": "hl7.fhir.bundle",
  "schemaVersion": "4.0.1",
  "recordId": "urn:uuid:11111111-1111-4111-8111-111111111111",
  "root": "79e4981b8e1e21b3e1d7a99346e7846d33f137f6ac684fec2c7d672e51b6f503",
  "leafCount": 10,
  "issuer": {
    "id": "did:web:corpus.roax.invalid",
    "keyId": "did:web:corpus.roax.invalid#key-1"
  },
  "disclosure": {
    "mode": "selective",
    "leaves": [
      {
        "segments": [
          {
            "key": "roax.recordType"
          }
        ],
        "displayPath": "roax.recordType",
        "index": 5,
        "tag": 2,
        "value": "hl7.fhir.bundle",
        "salt": "c24889ba40e46be7643a6c1d2030e125",
        "auditPath": [
          "cb113d9fe589d57a00b055a99ea15d9bb9e8468e76ac995aba740c415368add4",
          "4444bbc570e18c209081a9690f8142c4d055ba256084f2b6e277034fb26c2e6b",
          "a013f61aecfc4ba9caa2a5df435aece68561a4ac9cc9a287ab41cd8c977e6a81",
          "a96f392c63b63d23ed810e581e01182b01cf63e4da622bdfa3bad77a0ef0fdcc"
        ]
      },
      {
        "segments": [
          {
            "key": "roax.schemaVersion"
          }
        ],
        "displayPath": "roax.schemaVersion",
        "index": 7,
        "tag": 2,
        "value": "4.0.1",
        "salt": "dde8c29a376074d7043fc68d7c15061e",
        "auditPath": [
          "7339ae575cff53b25a97a6ce33c052fc4bc49ce9d082e94e9535f4283a7f4f19",
          "ac3014c3627de9d2333f0d9761bc1ec4cce88b3d3fee48f91fed5957c632a9ea",
          "a013f61aecfc4ba9caa2a5df435aece68561a4ac9cc9a287ab41cd8c977e6a81",
          "a96f392c63b63d23ed810e581e01182b01cf63e4da622bdfa3bad77a0ef0fdcc"
        ]
      },
      {
        "segments": [
          {
            "key": "roax.recordId"
          }
        ],
        "displayPath": "roax.recordId",
        "index": 3,
        "tag": 2,
        "value": "urn:uuid:11111111-1111-4111-8111-111111111111",
        "salt": "312b7634d0bbc798038f1516776c403b",
        "auditPath": [
          "0b1f7597b586d90430a397858817437708ab9781eb9e49653a5fce244caeb70f",
          "11c52c0aec8379719433ec142d2cfa9efed7d1f36a82c0f0ebc3249e56e8c2a7",
          "6452173bfe0fdd3daaf2d3330a1cc61b66b2f7af3e124db30403e79f9838a780",
          "a96f392c63b63d23ed810e581e01182b01cf63e4da622bdfa3bad77a0ef0fdcc"
        ]
      },
      {
        "segments": [
          {
            "key": "roax.issuer.id"
          }
        ],
        "displayPath": "roax.issuer.id",
        "index": 4,
        "tag": 2,
        "value": "did:web:corpus.roax.invalid",
        "salt": "81b4daf535d4f8dbc2a121bc2f4e92a7",
        "auditPath": [
          "9adcc7349988ab3de46ad35ae28c9fb2c3990cc4994662861eb3ba83064e5f39",
          "4444bbc570e18c209081a9690f8142c4d055ba256084f2b6e277034fb26c2e6b",
          "a013f61aecfc4ba9caa2a5df435aece68561a4ac9cc9a287ab41cd8c977e6a81",
          "a96f392c63b63d23ed810e581e01182b01cf63e4da622bdfa3bad77a0ef0fdcc"
        ]
      },
      {
        "segments": [
          {
            "key": "roax.issuer.keyId"
          }
        ],
        "displayPath": "roax.issuer.keyId",
        "index": 6,
        "tag": 2,
        "value": "did:web:corpus.roax.invalid#key-1",
        "salt": "2a485e75eaf030468968581cc7ee3b3e",
        "auditPath": [
          "6d3ad240b0cc1af03406e025664b0e3c2f68b089f2b6ca215aaa6b873a4e55e9",
          "ac3014c3627de9d2333f0d9761bc1ec4cce88b3d3fee48f91fed5957c632a9ea",
          "a013f61aecfc4ba9caa2a5df435aece68561a4ac9cc9a287ab41cd8c977e6a81",
          "a96f392c63b63d23ed810e581e01182b01cf63e4da622bdfa3bad77a0ef0fdcc"
        ]
      }
    ]
  }
}
