{
  "canon": "ROAX-CANON/1",
  "hashAlg": "SHA-256",
  "recordType": "hl7.fhir.bundle",
  "schemaVersion": "4.0.1",
  "recordId": "urn:uuid:11111111-1111-4111-8111-111111111111",
  "root": "3b1582fbf2cd2dcd5c6aac846769f27afecdda3f590152771673ff48697687ab",
  "leafCount": 10,
  "issuer": {
    "id": "did:web:corpus.roax.invalid",
    "keyId": "did:web:corpus.roax.invalid#key-1"
  },
  "disclosure": {
    "mode": "selective",
    "leaves": [
      {
        "segments": [
          {
            "key": "roax.recordType"
          }
        ],
        "displayPath": "roax.recordType",
        "index": 5,
        "tag": 2,
        "value": "hl7.fhir.bundle",
        "salt": "ec9d236b3e007da61de17bfdb4bb7a72",
        "auditPath": [
          "da73624f37f182db9c6198a44057057f101ce727e6ff7a41761f1326c76b919b",
          "f736758e9e307d493f72cda53c4f7245ca7ad4a4f3d94a057b0166382c495583",
          "810a3c364b309f38f635297ff3821db02741954df0ee1d89ea836e2018d290b9",
          "a1f66f34a0bcb40a6a655999705312e9eb35be1f69f66a683a6c4d1a2973e738"
        ]
      },
      {
        "segments": [
          {
            "key": "roax.recordId"
          }
        ],
        "displayPath": "roax.recordId",
        "index": 3,
        "tag": 2,
        "value": "urn:uuid:11111111-1111-4111-8111-111111111111",
        "salt": "7237c0666e573e896962cc9cac48e995",
        "auditPath": [
          "5afa516214bf759f4d047c69cca9d693f468d458f114af29102cadfb3fcadd62",
          "cfc82d2baa2e43b5d031238e8aad1e4f0182524670c7422f7bb58ec436abdb1b",
          "d1f8e05cda78227bce65362876324a1062760f77a704b8fc50c78d8a9ed9bfd9",
          "a1f66f34a0bcb40a6a655999705312e9eb35be1f69f66a683a6c4d1a2973e738"
        ]
      },
      {
        "segments": [
          {
            "key": "roax.issuer.id"
          }
        ],
        "displayPath": "roax.issuer.id",
        "index": 4,
        "tag": 2,
        "value": "did:web:corpus.roax.invalid",
        "salt": "ffc4f88482bb28a694469662cc732997",
        "auditPath": [
          "bc1ffa3f08bfa9876fbd3cdd38955f64a2b8771644e6f2a666762fca3c36db31",
          "f736758e9e307d493f72cda53c4f7245ca7ad4a4f3d94a057b0166382c495583",
          "810a3c364b309f38f635297ff3821db02741954df0ee1d89ea836e2018d290b9",
          "a1f66f34a0bcb40a6a655999705312e9eb35be1f69f66a683a6c4d1a2973e738"
        ]
      },
      {
        "segments": [
          {
            "key": "resourceType"
          }
        ],
        "displayPath": "resourceType",
        "index": 2,
        "tag": 2,
        "value": "Bundle",
        "salt": "53e10f091fc4968745c4d0b58c282e37",
        "auditPath": [
          "d6341e2f2f0fc8c44efaf9ac2d7f9f044655f4d811fc765aa549233487f0be0c",
          "cfc82d2baa2e43b5d031238e8aad1e4f0182524670c7422f7bb58ec436abdb1b",
          "d1f8e05cda78227bce65362876324a1062760f77a704b8fc50c78d8a9ed9bfd9",
          "a1f66f34a0bcb40a6a655999705312e9eb35be1f69f66a683a6c4d1a2973e738"
        ]
      },
      {
        "segments": [
          {
            "key": "roax.issuer.keyId"
          }
        ],
        "displayPath": "roax.issuer.keyId",
        "index": 6,
        "tag": 2,
        "value": "did:web:corpus.roax.invalid#key-1",
        "salt": "c02d53e6acebb60cd0c5bf1a18455764",
        "auditPath": [
          "4f1c7e5045d9f6ebdc3d73f79d66bbb103edd6bd7660155f2e7c46e06f4507f9",
          "7bd873d0c4a4a8c5b28477db854da56468818b1c104b0e3e81eac3d5303438a1",
          "810a3c364b309f38f635297ff3821db02741954df0ee1d89ea836e2018d290b9",
          "a1f66f34a0bcb40a6a655999705312e9eb35be1f69f66a683a6c4d1a2973e738"
        ]
      }
    ]
  }
}
